title,Logo,Tag,Description,Price,temp_link
Writesonic,https://raw.githubusercontent.com/rafliogun49/database_logo/main/resized_images/Writesonic.png,Copywriting,"Writesonic's new on-brand AI writer meticulously mirrors your brand's voice while delivering fact-checked, SEO-friendly content, all with a no-plagiarism guarantee. . The unlimited plan is 20% cheaper than ChatGPT and 50% cheaper than Jasper.",Paid,https://writesonic.com/ai-article-writer-generator
InLinks,https://raw.githubusercontent.com/rafliogun49/database_logo/main/resized_images/InLinks.png,SEO,"Awarded the Best AI-Driven SEO Tool of 2021, InLinks automates internal links, implements schema markup, and performs intelligent content audits. InLinks AI writing assistant helps you write cotnent, prioritize drafts, interlink current topics, and audit the current content and suggest improvements.",Freemium,https://inlinks.com
Quizgecko,https://raw.githubusercontent.com/rafliogun49/database_logo/main/resized_images/Quizgecko.png,Education,"Effortlessly create and analyze quizzes and flashcards from text, URLs, or YouTube videos, supporting multiple formats, languages, and files with useful feedback and time-saving features.",Paid,https://quizgecko.com/
Creatr,https://raw.githubusercontent.com/rafliogun49/database_logo/main/resized_images/Creatr.png,Copywriting,"Get over 70 of the best AI-based templates for creating article content, blog ideas, blog post intros, ad copy titles, sales page sections, and conclusions. Use chat assistants to automate ecommerce, improve social media presence. Generate captions and hashtags along with scripts!",Paid,https://creatrai.com/
Jasper,https://raw.githubusercontent.com/rafliogun49/database_logo/main/resized_images/Jasper.png,Copywriting,Generate plagiarism-free blog articles and original SEO content. Test instant copy variations to increase sales & social media engagement.,Paid,https://www.jasper.ai/
Grammarly,-,Productivity,Grammarly uses artificial intelligence to analyze your writing and make corrections based on context. The powerful AI grammar checker scans your writing for errors as you write so you can make sure everything is perfect,Freemium,https://shareasale.com/r.cfm
Riverside Audio Transcription,https://raw.githubusercontent.com/rafliogun49/database_logo/main/resized_images/Riverside%20Audio%20Transcription.png,Audio,"Riverside's free drag-and-drop transcription tool uses advanced AI from OpenAI to transcribe audio or video files in over 100 languages, with a user-friendly interface capable of processing hour-long interviews in less than 2 minutes",Free,https://riverside.fm/transcription
Prompt Hunt,-,Marketing,"Prompt Hunt, an AI Library, offers 200 marketing prompts to boost productivity and creativity for SEO, email marketing, and social media.",Free,https://www.mailmodo.com/ai-prompts/
Photo AI,https://raw.githubusercontent.com/rafliogun49/database_logo/main/resized_images/Photo%20AI.png,Image Editing,"Photo AI is an AI-powered photo editor and photo suite, offering AI-generated images from uploaded photographs or copycat-style images from freely available photos. It's the world's first AI photographer. And now includes background remover",Freemium,https://photoai.com/
Cheatlayer,-,Productivity,"CheatLayer's AI-powered platform automates business tasks with a language interface. Create apps, games, and websites in minutes, automate social media posting, and enjoy unlimited scraper cheat codes. The custom-trained GPT-4 model, Project Atlas, streamlines complex automation challenges.",Paid,https://cheatlayer.com/
CopySpace,https://raw.githubusercontent.com/rafliogun49/database_logo/main/resized_images/CopySpace.png,Copywriting,"CopySpace is one of the easiest-to-use and most efficient AI copywriting editors for crafting high ROI marketing blogs and copy. It uses advanced copywriting models, supports over 100 languages, offers quick content creation of up to 8000 words, and features over 100 ready-made blogging & marketing tools",Paid,https://www.copyspace.ai/
ChatGPT,https://raw.githubusercontent.com/rafliogun49/database_logo/main/resized_images/ChatGPT%20Writer.png,Chat,"AI language model ChatGPT is able to answer your questions, provide insightful information, and engage in witty banter. As an impartial and unbiased machine, ChatGPT can offer objective advice and perspectives. Aside from quick and accurate responses, it has a vast knowledge base and can entertain and educate at the same time.",Freemium,https://chat.openai.com/auth/login
Descript,https://raw.githubusercontent.com/rafliogun49/database_logo/main/resized_images/Descript.png,Audio,"Descript's transforms complex audio and video editing into a text-editing task. It can rapidly label speakers, clone voices realistically with Overdub (it removes filler words as well), produce speedy transcripts, remove gaps in recordings without affecting meaning and provide cohesive output by splicing together clips from different sources",Paid,https://www.descript.com/
Xinva,https://raw.githubusercontent.com/rafliogun49/database_logo/main/resized_images/Xinva.png,Generative Art,"AI for print on demand. A design generator for print-on-demand workflows. Translate your creative visions into innovative designs, used widely by designers to freelancers.",Paid,https://xinva.ai
adcopy ai,https://raw.githubusercontent.com/rafliogun49/database_logo/main/resized_images/adcopy%20ai.png,Advertising,"Write compelling, compliant ads in multiple languages with the help of custom ad-focused AI. From reworking competitors' ads to tailoring creativity levels, supercharge your ad strategy. Enhance your workflow with the Adcopy Chrome extension.",Paid,https://adcopy.ai
Simplified,https://raw.githubusercontent.com/rafliogun49/database_logo/main/resized_images/Simplified.png,Copywriting,"Write unique and best-in-class content for blogs, articles, ads, products and websites in just a few clicks. Create content that converts with 50+ templates.",Freemium,https://simplified.com/ai-writer/
Apify,-,Productivity,"Apify is a no-code platform that simplifies web scraping for AI model training. It integrates with tools like LangChain and Pinecone, streamlining data collection from the web. This enhances AI efficiency, delivers accurate insights, and supports customized AI tool development.",Freemium,https://apify.com/data-for-generative-ai
SiteSpeakAI,https://raw.githubusercontent.com/rafliogun49/database_logo/main/resized_images/SiteSpeakAI.png,Chat,"SiteSpeakAI is a chatbot powered by ChatGPT, offering personalized real-time 24/7 support for your website visitors. It improves customer interaction while optimizing conversions with easy integration and insightful analytics.",Paid,https://sitespeak.ai/
Rytr,https://raw.githubusercontent.com/rafliogun49/database_logo/main/resized_images/Rytr.png,Copywriting,Rtyr is the perfect assistant for brainstorming and writing content. And Rytr also now includes an AI image generation tool to accompany your writing.,Freemium,https://rytr.me/
CodeWP,-,Coding,Stop searching StackOverflow and crawling through forums. Create and test WordPress code snippets directly with the help of AI,Freemium,https://codewp.ai/
Linguix,-,Copywriting,"Linguix is a productivity tool that helps you write better by automatically checking grammar, punctuation, and style using AI-based language NLP",Paid,https://shareasale.com/r.cfm
Castmagic,https://raw.githubusercontent.com/rafliogun49/database_logo/main/resized_images/Castmagic.png,Podcasting,Castmagic converts lengthy audio files into short excerpts that retain the original content's key points. It's particularly helpful for companies trying to grow their business through podcasting and other forms of longform audio content.,Paid,https://www.castmagic.io/
Hexomatic,https://raw.githubusercontent.com/rafliogun49/database_logo/main/resized_images/Hexomatic.png,Automation,"Leverage AI to scrape content from any website, find local busıness prospects in a few clicks using Google Maps, monitor Amazon for updates on specific products, or bulk create screenshots in any screen size to use in your marketing materials or software.",Paid,https://hexomatic.com/pricing_promo/
SkipVid,https://raw.githubusercontent.com/rafliogun49/database_logo/main/resized_images/SkipVid.png,Productivity,Copy and paste a YouTube link into a field and receive a summary of the video (free for up to 10 minutes),Freemium,https://skipit.ai
tl;dv,-,,"Discover the GPT-powered meeting software to video record, transcribe, highlight and share your online meetings.",Freemium,https://tldv.io/